[
  {
    "id": 1,
    "img": "saiwengshima.png",
    "idiom": "塞翁失马",
    "pinyin": "sài wēng shī mǎ",
    "literal_translation_en": "The old man at the frontier loses his horse",
    "core_meaning_en": "A seeming misfortune may turn out to be a blessing — and vice versa.",
    "history_background_en": "The story appears in the Huainanzi, a philosophical anthology compiled at the court of Liu An, a Han-dynasty prince, in the 2nd century BCE. The setting — a small settlement on the frontier with nomadic Xiongnu raiders nearby — reflects the everyday reality of life on China's northern border.",
    "story_en": "Near the northern frontier there lived an old man who understood the patterns of fate. One day his horse ran away across the border into Xiongnu territory, and his neighbors came to console him. The old man simply asked, 'How do you know this is not a blessing?' Months later the horse returned, bringing a fine Xiongnu stallion with it. When the neighbors congratulated him, he asked, 'How do you know this is not a misfortune?' His son, fond of riding, broke his leg falling from the new horse. As the neighbors offered their sympathy, the old man again asked, 'How do you know this is not a blessing?' Soon the Xiongnu invaded in force, and every able-bodied young man in the settlement was conscripted — nearly all of them died in battle. Only the old man's son, crippled by his broken leg, was spared, and father and son survived together.",
    "cultural_insight_en": "The old man embodies a deeply Daoist attitude toward fortune: reality is in constant flux, and any single judgment of 'good' or 'bad' is premature. The Chinese concept of 福祸相依 (fortune and misfortune lean on each other) treats events not as isolated verdicts but as links in an endless chain of change. Where a Western instinct might rush to classify an outcome, Daoist wisdom counsels patience, equanimity, and a humble acknowledgment that we cannot see the whole picture from inside it. The story is not fatalism — it is a call to keep an open mind, because the meaning of today's loss is only revealed by tomorrow's gain.",
    "modern_cultural_relevance_en": "The phrase is still used daily in China to comfort someone who has just lost a job, failed an exam, or suffered a setback: 塞翁失马，焉知非福 — 'the old man lost his horse, how do you know it is not a blessing?' It is the classic Chinese formula for reframing disappointment as opportunity.",
    "origin_source": "Huainanzi, 'Lessons of the Human World' (《淮南子·人间训》), 2nd century BCE",
    "tags": ["philosophy", "resilience"]
  },
  {
    "id": 2,
    "img": "woxinchangdan.png",
    "idiom": "卧薪尝胆",
    "pinyin": "wò xīn cháng dǎn",
    "literal_translation_en": "Sleep on firewood and taste gall",
    "core_meaning_en": "To endure self-imposed hardship as a discipline for achieving a long-delayed goal.",
    "history_background_en": "In the Spring and Autumn period (5th century BCE), the states of Wu and Yue fought a bitter rivalry for dominance in the lower Yangtze region. After King Fuchai of Wu crushed the Yue army, the defeated King Goujian was taken to Wu as a captive servant — a personal humiliation within a world of honor-bound kings.",
    "story_en": "After his defeat, King Goujian of Yue was made to serve as a groom and laborer in the palace of his conqueror, King Fuchai of Wu, enduring three years of servitude and humiliation before he was allowed to return home. Back in Yue, he refused to let himself forget. He slept on a bed of firewood instead of soft cushions, and hung a bitter gall bladder from his ceiling so that he tasted it every morning and every evening, forcing himself to relive the bitterness of his defeat. He lived frugally, worked alongside his people in the fields, and quietly rebuilt his army and economy — the strategy known as 'ten years of recovery, ten years of training.' Twenty years after his humiliation, Goujian launched his counterattack, crushed Wu in battle, and forced the suicidal Fuchai to drink his own bitter end. Yue became the dominant power of the region.",
    "cultural_insight_en": "卧薪尝胆 is China's classic image of willpower converted into daily ritual. The key insight is not vengeance but self-governance: Goujian's genius was turning shame into a renewable source of discipline, keeping the goal vivid through a physical act repeated every single day. In Chinese thought, great achievement is expected to pass through humiliation (忍辱负重) — endurance of disgrace is not weakness but the forge of character. The story also reveals the Chinese belief that time itself is a strategic resource: given enough patience, patience itself becomes an unstoppable weapon. It remains the standard metaphor for anyone quietly preparing, denying themselves comfort, and refusing to let success outrun preparation.",
    "modern_cultural_relevance_en": "The idiom appears constantly in Chinese business and political rhetoric — a struggling startup, a losing sports team, or a company doing 'ten years of research' is described as 卧薪尝胆. It frames long, unglamorous preparation as the most admired form of ambition.",
    "origin_source": "Records of the Grand Historian (《史记·越王勾践世家》), Sima Qian, 1st century BCE",
    "tags": ["resilience", "strategy", "leadership"]
  },
  {
    "id": 3,
    "img": "fujinqingzui.png",
    "idiom": "负荆请罪",
    "pinyin": "fù jīng qǐng zuì",
    "literal_translation_en": "Carry brambles on one's back and ask for punishment",
    "core_meaning_en": "To openly admit one's fault and sincerely seek reconciliation, even at the cost of pride.",
    "history_background_en": "In the Warring States period (3rd century BCE), the state of Zhao was caught between the aggressive Qin empire and its rival kingdoms. Two men saved it: the brilliant diplomat Lin Xiangru and the seasoned general Lian Po. After Lin's diplomatic triumphs at the 'Jade Returns to Zhao' and the Mianchi meeting, King Huiwen promoted him above the general — an unprecedented breach of military hierarchy.",
    "story_en": "General Lian Po, who had won his rank through decades of battlefield service, was furious that a courtier promoted purely for his tongue now stood above him. He swore to humiliate Lin Xiangru whenever they met. Lin, hearing of this, began avoiding Lian Po entirely — pleading illness to skip court, and once even turning his carriage around to avoid a confrontation. His own retainers, ashamed, threatened to leave him. Lin Xiangru explained: 'Qin does not dare to attack Zhao only because Lian Po and I are both here. If two tigers fight, neither survives. I yield for the sake of the state — because the interests of Zhao come before my private grudges.' When Lian Po learned of this, he was stricken with shame. Stripping off his upper garments and carrying a bundle of thorny brambles on his bare back, he walked to Lin's gate, knelt, and asked to be beaten for his arrogance. The two embraced, became inseparable friends, and together defended Zhao for years.",
    "cultural_insight_en": "The story's power lies in its two complementary acts of courage. Lin Xiangru's courage is the rarer kind: enduring public humiliation and reputation damage to protect a larger interest — putting the common good ahead of personal honor (先国家之急而后私仇). Lian Po's courage is the spectacle: the greatest general in the land publicly kneeling under thorns, demonstrating that in Chinese moral culture, the ability to admit fault is not shameful but the highest form of integrity. The idiom 负荆请罪 is used to this day whenever someone apologizes unconditionally — a reminder that in the Chinese moral universe, harmony (和) is built not by never erring, but by the graceful rituals of admitting error.",
    "modern_cultural_relevance_en": "The story of 'General and Minister Make Peace' (将相和) is one of the most performed pieces in Chinese opera. In modern China, 负荆请罪 is invoked whenever a public figure apologizes without excuses — and the idiom sets the cultural bar for what a sincere apology is supposed to look like: complete, unconditional, and slightly theatrical.",
    "origin_source": "Records of the Grand Historian, 'Biographies of Lian Po and Lin Xiangru' (《史记·廉颇蔺相如列传》), 1st century BCE",
    "tags": ["virtue", "friendship", "harmony"]
  },
  {
    "id": 4,
    "img": "sangumaolu.png",
    "idiom": "三顾茅庐",
    "pinyin": "sān gù máo lú",
    "literal_translation_en": "Three visits to the thatched cottage",
    "core_meaning_en": "To pursue talent with sincerity and patience, showing respect that cannot be bought.",
    "history_background_en": "At the end of the Eastern Han dynasty (2nd century CE), the empire was collapsing into warlord chaos. Liu Bei, a prince of the Han imperial house, had spent two decades fighting without a stable base. In his mid-forties, near despair, he heard that a young hermit named Zhuge Liang — later known as Kongming — was living in seclusion in a thatched hut in Longzhong, studying the world and waiting for a worthy lord.",